desarrollador,titulo,descripcion,proyecto,fecha de entrega,prioridad
Javier,Hacer vistas,Crear las vistas necesarias,Proyecto COVID-19,20/05/2020,6
Javier,Revisar errores,Errores en el proyecto 1,Proyecto COVID-19,20/05/2020,10
Estuardo,Solucionar errores,Buscar y corregir errores,Proyecto COVID-19,20/05/2020,7
Estuardo,Tabla hash,Hacer tabla hash,Lab 5,16/04/2020,0
Francisco,Hacer modelos,Modelos para proyecto,Proyecto COVID-19,20/05/2020,8
Francisco,Hacer tabla hash,Solucionar colisiones,Lab 5,16/04/2020,3
Francisco,Archivos,"Leer, escribir y editar archivos",Lab 5,16/04/2020,5
Javier,Hacer controlador,Controlador para hospitales en el proyecto,Proyecto COVID-19,20/05/2020,3